Video ID,Comment,Timestamp
rHZWOW-eTTk,"Thank you both for replies. I see I think. -3% vs. -1% = buying back 3% vs buying back 1%. 

if the share change was say -3%, 0%, 3% for the assumptions the order would still be -3, 0, 3 correct?

Already part of the community but its too chaotic using discord. I like the software, but confused solely on the share change for whatever reason. 

The higher to lower on the Desired Annual Return makes sense.

Once again, thank you for the clarification and for doing what you do!",2021-09-27T19:02:05Z
rHZWOW-eTTk,"@Russianm0fia instructions are correct, -3% means they will buyback 3% of the company on buybacks and should be on the high assumption",2021-09-27T17:52:35Z
rHZWOW-eTTk,"​@Everything Money -1 is higher than -3 , it would be nice if the UI warned users of such mistakes, it has been suggested on the discord already.",2021-09-27T17:50:14Z
rHZWOW-eTTk,"No Russian -3 is higher. 
If you want to learn more feel free to join our community. - 👍GC",2021-09-27T17:42:30Z
rHZWOW-eTTk,@LongTheWorld it is but the question isn't whether its over valued. The question is did they input that line wrong or are the instructions wrong? One of those is wrong and I need to know for future companies.,2021-09-27T17:41:26Z
rHZWOW-eTTk,"That is true, -1 is the higher number,  it is still overvalued",2021-09-27T17:39:13Z
rHZWOW-eTTk,"i would love to see your thoughts on Rio Tinto PLC only a pe of 6 ,151 billion company and 10% dividend",2021-09-27T17:30:28Z
rHZWOW-eTTk,"What about a comparison of Luxury Fashion Brands...
They often have high margins and the middle class keeps getting bigger..
A lot seem to be undervalued since this news coming out of China...

RL, BURBY, LVMUY, CPRI, TPR, PPRUY",2021-09-27T17:28:51Z
rHZWOW-eTTk,"Can you please analyse J.M. Smucker or Mondelez, two food companies with a great Moat in my opinion.",2021-09-27T17:27:10Z
rHZWOW-eTTk,Cisco again?????? Come on... At least once or twice a year.,2021-09-27T17:26:16Z
rHZWOW-eTTk,I’d love to see your thoughts on Celanese (CE),2021-09-27T17:22:55Z
rHZWOW-eTTk,Bought into CSCO when it was $45 ;),2021-09-27T17:20:12Z
rHZWOW-eTTk,My HPQ Stock Is Rising How Good Does It Feel When Your Stock Is Going Up 🥳🥳😁😁 continuously day to day 🤣🤣,2021-09-27T17:16:08Z
rHZWOW-eTTk,"Love watching you guys, still get turned off a lot by Paul insulting people that are having trouble understanding it.
There is enough entertainment in your character already and your pitch for the software is working.
You are doing a great job with the channel funneling sales to your software and creating leads with the discord. The insults will just drive the wrong people to your community.",2021-09-27T17:15:57Z
rHZWOW-eTTk,When will you get uk stocks? There's a lot of undervalued companies in the ftse,2021-09-27T17:13:48Z
rHZWOW-eTTk,Would love to see you do Tyson Foods! I think they’re undervalued and a great company,2021-09-27T17:12:51Z
rHZWOW-eTTk,Hundreds of stocks to cover than Cisco and Intel every other day. Jesus,2021-09-27T17:08:26Z
rHZWOW-eTTk,Thumbnail means business!,2021-09-27T17:05:31Z
rHZWOW-eTTk,"What happened to the thumbnail? 😅
Anyway, love your content guys, keep going, you’re getting closer to 100k! 🤩",2021-09-27T17:02:00Z
3zogh1-Fm08,WebEx needs to take significant market share from Zoom.  Just like Intel needs to take significant market share from AMD.,2022-01-30T20:30:44Z
3zogh1-Fm08,"NVidia (Apples) and Cisco (Oranges) comparison is not fair.  One is developing GPU, Omniverse etc while the other one focused on network gears.  Yes, they do meet in the Datacenter space, but they are not in a head to head competition (maybe pick Arista or Palo Alto).  Yeah I get it, he’s thinking of fund allocations rather than the company fundamentals, but I still say that’s not a realistic comparison.",2021-12-28T13:18:08Z
3zogh1-Fm08,If price no longer matters why even have different stocks and just have a big game of chicken.. 1 stock you put your money in and the person who gets out at the top wins..that's basically what this market is,2021-11-21T04:56:01Z
3zogh1-Fm08,"NVDA, NVDA, NVDA.  My God CNBC can't pump enough a stock so overvalued, that its latest report really doesn't support this super high evaluation.  Look for example QCOM who farmer Jim has been pounding the table to buy now for a year.  They had better earnings, Qcom beat by .44 cents on eps and .44 billion revenue vs NVDA’s beat by 6 cents eps and .28 billion. Qcom basically doubled NVDA’s profit and almost 30% higher in revenue and has a PE of 20.  Future growth I put both companies roughly the same, 15% -20%.  So why buy NVDA who to triple will have a market cap of 2.4 trillion and not QCOM at 600 billion?",2021-11-20T15:25:57Z
3zogh1-Fm08,That stock is so dead even BABA performt better althou down more than 50%,2021-11-20T00:25:33Z
3zogh1-Fm08,Sad thing is that people have been saying that Cisco is a dead company for 5 years now. in that time period the stock price has doubled,2021-11-19T20:34:15Z
3zogh1-Fm08,"Load up on Tesla and you will be a happy camper,your welcome",2021-11-19T04:50:21Z
3zogh1-Fm08,CISCO is a great buy. A stock that should form part of one's retirement portfolio.,2021-11-19T03:15:52Z
3zogh1-Fm08,This was THE stock in 1999,2021-11-19T02:20:50Z
3zogh1-Fm08,The canary in the mine died,2021-11-18T20:42:33Z
3zogh1-Fm08,Why do you have to question a guy about one stock because the stock is down after earning a report? Are you trying to pump NVDA or promote this crazy idea -  just buy the growth stocks?,2021-11-18T20:02:38Z
3zogh1-Fm08,I am an embedded system and AI engineer and I think NVDIA's earning yield is just insane it could drop 80% a day with bad news its valuation is going years ahead.,2021-11-18T19:02:27Z
3zogh1-Fm08,@Duke of Prunes II nvidia isnt anywhere topped either... you seriously have no idea how big market is ahead of nvidia its bigger than teslas but tesla will be in the same market in future,2022-01-09T01:38:16Z
3zogh1-Fm08,@videogaminglmao NVDA is a good company. No argument. But Tesla isn't any where near topped out -- my money is on Tesla.,2022-01-09T01:32:59Z
3zogh1-Fm08,"@Duke of Prunes II everyone has competitors, nvidia has too but nvidia is just simply best in their areas so theres no one that can beat them because nvidia is very innovative company like tesla.",2022-01-09T01:26:11Z
3zogh1-Fm08,"@Long Dated Options LEAPS Tesla doesn't really have a serious competitor, yet. NVDA does. My wife already bailed out on NVDA at $320 to buy more Tesla.",2021-11-26T01:24:15Z
3zogh1-Fm08,Load up on Tesla and you will be a happy camper in 10 years,2021-11-19T04:49:06Z
3zogh1-Fm08,"@Cascade98 I think I x100 my money on NVDA. I am not buying directly anymore and soon will sell it all and put in SOXX, semiconductor ETF.",2021-11-19T01:54:22Z
3zogh1-Fm08,@J Lmao I am 28y old :D,2021-11-19T01:52:39Z
3zogh1-Fm08,"Everyone said the same thing when I bought at 170 presplit, and now look where it is. I definitely wouldn't be buying it here, because it is very expensive right now plus the stock always has 25-35% corrections that offer better buying opportunities. But it'd be hard to convince me that its not a buy if it dips back into the low/mid 200s. The growth is too good and CEO Huang deserves a premium for the fantastic job he has done and continues to do with the company.",2021-11-18T21:03:21Z
3zogh1-Fm08,Ok boomer,2021-11-18T20:46:31Z
3zogh1-Fm08,"No question its very very pricy …. But I’ve been told that about Tesla since its was $300 and Amazon decades ago…. U invest in NVDA because of Jensen, dido for Tesla its an investment in Elon and Amazon it was for Bezos …. But yeah applying any normal valuation metrics u wouldn’t touch with a 10 foot poll.",2021-11-18T20:01:54Z
uZ7qhT8-9kU,Work at home is wrong,2022-02-15T00:37:20Z
uZ7qhT8-9kU,#CramerIsANazi #BanCramer #BoycottCramer,2021-12-01T22:14:50Z
uZ7qhT8-9kU,SOLANA and AVAX are the best investments after Bitcoin and Gold against inflation,2021-11-19T08:17:30Z
uZ7qhT8-9kU,Uhh his investor club said he was sticking with it…,2021-11-19T07:34:09Z
uZ7qhT8-9kU,Cramer is right on this one. Cisco is trash,2021-11-18T22:34:31Z
uZ7qhT8-9kU,Now the time to buy Cisco. Do opposite what Jim says.,2021-11-18T21:05:19Z
uZ7qhT8-9kU,Have you ever met a Cisco employee? I have many. All clowns.,2021-11-18T17:53:33Z
uZ7qhT8-9kU,"11/18/2021 WHEN WE GET A NEW FED CHAIR NEXT YEAR AND A SOUND US MONETARY POLICY RETURNS THERE WILL BE A RETURN TO REALITY AND NOT THE ""ALICE IN WONDERLAND"" WORLD WE LIVE IN TODAY.  THE REALLY GOOD NEWS IS THAT THE SP500 WILL BE DOWN 1000 POINTS IN A SINGLE DAY LIKE THE 24% DECLINE IN OCT 1987 AND THERE WILL BE REASONABLE STOCK EVALUATIONS ONCE AGAIN!!",2021-11-18T16:16:09Z
uZ7qhT8-9kU,"Not my fault irish police, journalists and polititions are not the sharpest tools in the european drawer.",2021-11-18T16:12:48Z
uZ7qhT8-9kU,"You can keep removing my comments, but RTE and an Garda Siocana are in big trouble and getting sued.",2021-11-18T16:10:20Z
_y-K6UrwEtI,Intel is just now talking about releasing a GPU in Q1 2022? Meanwhile it makes up about 50% of NVDIA revenue? Why so late to the game? Extremely poor strategic planning. Brutal.,2022-01-03T03:39:09Z
_y-K6UrwEtI,"1) Most of the FAANG, Tesla pack of stocks  will crash by at least 50 % over the next 6 months to 2 years 

These have been floating at or near  Extreme valuation levels indicating irrational exuberance


2) Minor mistakes, missteps by them or apprehensions by the investors  will be enough to harm their stocks heavily 

Their multiples will face intense scrutiny as it will be Very difficult for them to continue to deliver such growth in the coming quarters & years.


3) Apple investors will get fried If Apple Car turns out of be a dud in front of Tesla, Volkswagen electric, Nissa, Ford F150 etc 

Volkswagen & Ford will give tough Challenge to Tesla in the coming years

Toyota and others are coming up with hydrogen cell/fuel cell-based alternatives",2022-01-02T16:47:03Z
_y-K6UrwEtI,Good luck with that,2022-01-02T16:04:58Z
_y-K6UrwEtI,I can get intel but why imb or cisco?,2022-01-01T18:46:27Z
_y-K6UrwEtI,Really IBM? lol,2021-12-31T03:51:52Z
_y-K6UrwEtI,Just wait for FAANG to correct 10 to 20% and buy those names instead...,2021-12-31T02:36:52Z
_y-K6UrwEtI,There's no way IBM CISCO and Intel can compete with FAANG. (Nvidia),2021-12-31T02:34:17Z
_y-K6UrwEtI,Only a matter a time faang.. just like ici in 2000...🐻🧢,2021-12-31T02:24:39Z
_y-K6UrwEtI,"fine
if you are working with allot of cash.",2021-12-31T01:19:28Z
_y-K6UrwEtI,"Sorry sir Facebook trades at 23 times earnings.  Completely reasonable for a company expected to grow revenue at 20%+. 

What’s unreasonable is paying 18 times earnings for Cisco that might grow earnings 3%.   Its all about fair valuation.",2021-12-31T01:02:46Z
_y-K6UrwEtI,"yah ok buddy .... I am in tech - literally no one I know wants to work for those names 

the best and brighest go to FAANG or equivalent. aka they have the best human resources thus the best products. 

and so they will keep innovating and envisioning the future. good luck with your ibm and cisco investments. 

some of these money managers are pure idiots.",2021-12-31T00:28:50Z
_y-K6UrwEtI,ICI is not how you spell TRASH,2021-12-31T00:02:38Z
_y-K6UrwEtI,There is nothing special about ibm.,2021-12-30T23:59:13Z
_y-K6UrwEtI,ok boomer,2021-12-30T22:59:12Z
_y-K6UrwEtI,"Maybe if they cut the dividends and reinvested the capital to grow their businesses more people would be long. They are now trapped as stocks for dividend investors. Philosophically, I don't want to own Tech for dividends. Tech is innovation. Those three stocks aren't innovators (currently).  If I want dividends, I'll go to Big Pharma, MCD, MO, etc.",2021-12-30T22:20:39Z
_y-K6UrwEtI,buffet left ibm. i really doubt that its a wise decision to go into ibm anytime soon. he would have stayed in if he saw anything positive in it.,2021-12-30T21:55:44Z
oPV8REAjklw,Prepping for interview! Thank you!!,2021-04-25T20:37:33Z
oPV8REAjklw,"Absolute garbage CEO and garbage Stock. This thing has not moved out of the 30 to $40 range in past 3 years. Covid that put Zoom at like $500 a share. While Csco is still in $40. Maybe Tim Robins can focus on giving more money to BLM and firing more employees who dont support BLM. This is how Woke CEO's save themselves ""Oh who cares if stock does well. See how much money i gave to BLM"".",2021-02-19T09:51:51Z
oPV8REAjklw,"Please,  watch these tech companies tell your ass to come back to the office.",2021-02-11T01:42:14Z
oPV8REAjklw,boomer stock,2021-02-10T22:56:04Z
oPV8REAjklw,"can someone just fire Cramer,,his stupid voice and face are simply disgustin",2021-02-10T16:07:16Z
oPV8REAjklw,Good thing your not a small business in California,2021-02-10T15:55:26Z
oPV8REAjklw,cisco needs new CEO,2021-02-10T15:46:32Z
oPV8REAjklw,"environment only challenging for Cisco, look at other networking stocks.. ?",2021-02-10T15:42:57Z
oPV8REAjklw,Happy bday Jim,2021-02-10T15:34:38Z
_hmHqQtXMX4,Chuck seems nervous and not confident. He is in over his head. You sir are no John Chambers.,2021-11-20T16:01:38Z
_hmHqQtXMX4,Cisco is not the best nor a fantastic name to own but it’s decent. You can’t have your whole portfolio exciting.,2021-11-18T07:16:03Z
_hmHqQtXMX4,Gobble gobble,2021-11-18T01:19:52Z
Mxwfe2plKFk,Can you please cover PYPL? It’s been part of a big correction lately. There’s so much new competition it’d be interesting to hear your opinion on it given it’s a good company but was likely overvalued.,2021-11-22T14:44:30Z
Mxwfe2plKFk,Can you add ZTS to the list of viewer stocks to analyze please!,2021-11-22T00:44:01Z
Mxwfe2plKFk,"Hey Chuck! I had to take a YT break. Too much media lately. Could you do a subscriber request on Enbridge? I own some, bought last year and I'm up. It's fallen and considering adding more. Could you talk about investor psychology on buying a stock that you already own when it's more than you cost basis. Barriers to averaging up are hard for me. 
For example I would happily buy if it fell under my cost basis of $35..? Thank you for all you do!",2021-11-21T22:49:40Z
Mxwfe2plKFk,Can you do a video on your favorite stock to invest in at this time?,2021-11-21T15:24:48Z
Mxwfe2plKFk,Hi Chuck! I started watching your channel 3 months ago or so and I haven't missed a single one since. I am a fan of your F.A.S.T. tool and have a feeling I will be adding an annual subscription for the first time soon. The only reason I haven't purchased it yet is I'm hoping you will run some kind of Black Friday sale? I'll wait a few more days... Also noticed that Lyn Alden uses this tool. Saw it at one of her recent videos.,2021-11-20T22:28:28Z
Mxwfe2plKFk,Loving the flurry of tech videos atm Chuck - on a different note could you look at Associated British Foods please? Had a dip recently but would like a better picture of the fundamentals...,2021-11-20T15:02:50Z
Mxwfe2plKFk,"Interested in your review of WDC (Western Digital), STX (Seagate). Both are in the same market with potentially good returns; WDC looks better IMO. Thank you, Chuck!",2021-11-20T00:45:33Z
Mxwfe2plKFk,Dec 6th count down begins!,2021-11-20T00:04:12Z
Mxwfe2plKFk,"I was looking at Cisco, I will buy some (for growth+dividend) if the price approach to 49-50",2021-11-19T18:59:55Z
Mxwfe2plKFk,"Great news! And thanks for the quick lesson! I got out of Cisco as it was getting in the over valuated field, if I can get some margin of Safety I can add a little bit more, but I'm fine currently. Thanks, I'll see you in the next one!",2021-11-19T16:51:15Z
Mxwfe2plKFk,"Chuck your videos are so amazing und pure quality, next time Alibaba after the earnings plz 🙏",2021-11-19T15:26:14Z
Mxwfe2plKFk,"Very nice lesson in ""real time.""",2021-11-19T14:36:09Z
Mxwfe2plKFk,"Hey Chuck, how about XLNX? Thanks",2021-11-19T10:19:06Z
Mxwfe2plKFk,Chuck - Is it better to take profit in CSCO and buy OMC - 4% YIELD? I do have 17% profit in CSCO,2021-11-19T04:30:27Z
Mxwfe2plKFk,Thanks for the video.  Keep them coming and I'll keep watching and subscribing to fast graphs. It's like having an insurance policy that keeps you from making stupid mistakes (taking on too much risk),2021-11-19T04:23:31Z
Mxwfe2plKFk,Now I feel better that I bought more today @ $52 a share. Thanks for the insightful video.,2021-11-19T04:02:36Z
Mxwfe2plKFk,I notice on Fastgraph that the blue line is always above the orange line.  I guess the public is generally more optimistic than they should be.,2021-11-19T01:06:12Z
Mxwfe2plKFk,I have them in my Depot.I buyed 2 Times and now have a mixed Share prize of about 41$.,2021-11-18T23:23:51Z
Mxwfe2plKFk,Looking forward to the new version of Fastgraphs December 5th! Thanks for the update Chuck!,2021-11-18T21:47:32Z
Mxwfe2plKFk,"Dec 5th, can't wait!  Really looking forward to it. I had bought 800 CSCO @ 46.69 and sold out            @52.93 held it for about 2 years, but I was a little antsy, this was before I subscribed to FAST Graphs, what a difference it has made in my investments.  Thanks, Chuck!",2021-11-18T21:08:34Z
Mxwfe2plKFk,Perfect timing Chuck!,2021-11-18T20:55:24Z
Mxwfe2plKFk,"Great vid today, keep it up!",2021-11-18T20:29:53Z
Mxwfe2plKFk,How is Amgen???,2021-11-18T20:27:56Z
Mxwfe2plKFk,Are you interested in VTRS?,2021-11-18T20:15:11Z
Mxwfe2plKFk,Hello Mr. Vaulation 👋,2021-11-18T19:59:03Z
Mxwfe2plKFk,"Lovely quality stock, which i only have a small position of at the moment.The balancesheet looks very healthy. Will gladly buy more if it drops further :)",2021-11-18T19:57:38Z
Mxwfe2plKFk,"I love your videos! As a young investor I really like them a lot, so much to learn. I also have steal some ideas from you: snap on, afl, and amgen! Really good stocks",2021-11-18T19:56:56Z
Mxwfe2plKFk,"R.I.P the dislike button
:(",2021-11-18T19:56:08Z
Mxwfe2plKFk,What do you think about ENB?,2021-11-18T19:43:28Z
Mxwfe2plKFk,"CSCO has been on my watch list for some time, I am waiting for it to come down in price to a more favorable valuation. The timing on this video is uncanny as I just looked at CSCO again this morning!  Thanks!",2021-11-18T19:19:04Z
Mxwfe2plKFk,"Interesting! There are not many value tech stocks at a reasonable price. But you covered a few this week! Thanks, man 👊",2021-11-18T19:12:22Z
Mxwfe2plKFk,Very very important video Chuck. I'm learning so much!  You should really be proud. Great job man.,2021-11-18T18:59:40Z
Mxwfe2plKFk,9:02 i thought that was my computer :),2021-11-18T18:57:13Z
Mxwfe2plKFk,"CSCO is an awesome lesson ! I just bought FB for the first time, look to build up a huge Position !",2021-11-18T18:53:59Z
I1v5m1rUOTM,52 week high for CSCO,2021-08-19T18:53:10Z
I1v5m1rUOTM,good luck,2021-08-19T15:21:11Z
I1v5m1rUOTM,Umm Mr. Powell I think your meme market needs another hit of that monitory crack you slanging.,2021-08-19T15:16:42Z
tE_xFSifUes,Just bought 13 shares in Cisco and Walgreens and will add more. Those dividends and stability can not be overlooked,2021-03-08T01:06:27Z
tE_xFSifUes,1:45 - Cisco explained on the earnings call call that it’s higher revenue forecast had an artificial component because Q3 includes an extra calendar week.,2021-02-11T19:54:37Z
tE_xFSifUes,"unpopular opinion i suppose but.... CSCO is awful.  maybe the company is decent, but that stock consistently underwhelms quarter after quarter.",2021-02-10T13:06:16Z
tE_xFSifUes,They seem to be trading at a rather fair price.,2021-02-10T08:28:55Z
tE_xFSifUes,I’m adding Cisco to my dividend portfolio tomorrow,2021-02-10T01:01:50Z
tE_xFSifUes,Been looking at Cisco for awhile. Another pull back would be great,2021-02-10T00:16:04Z
tE_xFSifUes,"I love Cisco. They have enough assets in the Networking market to not go anywhere anytime soon, and they usually are pretty innovative. I believe they are going through a bit of a slump, but hopefully will rebound soon.",2021-02-10T00:15:48Z
BXMylWXaCgs,"Great post 🙌🏻 i must say. Crypto is tumbling, with little sign of stopping throughout the past few days and weeks, with bulls and bears both reaching a clear impasse, the aggregated cryptocurrency market has been following in Btcoin's lead and is struggling to garner any decisive momentum. One analyst is now noting that BTC has been holding above a key macro level throughout the past few months. He believes that the recent consolidation above this level bodes well for its near-term outlook and could indicate that significantly further upside is imminent in the weeks and months ahead. Tips like this are why it's advisable for investors and newbies to trade with the help of pro traders like Bran Marvel . He is always one step ahead of other traders, he fully monitored all my trades to avoid me making mistakes and losing my money. My earnings have increased drastically from 0.30 BTC to 3 BTC in just 8 weeks using his strategy. You can easily get hold of him for a profitable system on TE-LE-GRAM [@Bran_signals]",2021-07-07T07:58:36Z
BXMylWXaCgs,"I never doubted trading with Bran after seeing his POT (Proof of Trades) I made good profit last year, I hope to make more.",2021-07-07T08:02:10Z
BXMylWXaCgs,Investing in Crypto is actually the wisest thing to do now despite everything going on in the world,2021-07-07T08:01:41Z
BXMylWXaCgs,"His signals works like magic! He was recommended by a friend in Illinois, I got to try his strategy and it is 100% viable.",2021-07-07T08:01:09Z
BXMylWXaCgs,Never regret dealing with Bran on telegram  because am also excited seeing 1.30btc in my wallet today,2021-07-07T08:00:51Z
BXMylWXaCgs,This is top rated and one of the best you could get out there when it comes to trading crypto,2021-07-07T08:00:33Z
BXMylWXaCgs,Cryptocurrency  investment is here to stay and if you can't see that  in this point then its time you learn more about it,2021-07-07T08:00:17Z
BXMylWXaCgs,He taught me how to trade and recommended some good exchange with lesser fees,2021-07-07T07:59:58Z
BXMylWXaCgs,"Have thought of going into bitcoin Trade lately, Thanks for the information and I hope he will also guide me with his signals",2021-07-07T07:59:42Z
BXMylWXaCgs,Crypto is the future,2021-07-07T07:59:26Z
BXMylWXaCgs,This is the right time to get into day trading,2021-07-07T07:59:10Z
BXMylWXaCgs,First to contact him,2021-07-07T07:58:56Z
BXMylWXaCgs,Sundial stock to the moon soon,2021-07-07T03:35:00Z
BXMylWXaCgs,Pete knows call premiums are taxed as ordinary income while dividends are not. Not apples to apples.,2021-07-06T21:32:31Z
ZyaxpS37Oqs,"2:15 C.H.A.N.C.E T.O W.I.N I.P.H.O.N.E 💓 CLICK HERE : youtu.be/49mwt6s95aY



!💖🖤❤️今後は気をライブ配信の再編ありがとうです！この日のライブ配信は、かならりやばかったですね！１万人を超える人が見ていたもん（笑）やっぱり人参最高！まさかのカメラ切り忘れでやら1かしたのもドキドキでした,. 💖🖤在整個人類歷史上，強者，富人和具有狡猾特質的人捕食部落，氏族，城鎮，城市和鄉村中的弱者，無`'守和貧窮成員。然而，人類的生存意願迫使那些被拒絕，被剝奪或摧毀的基本需求的人們找到了一種生活方式，並繼續將其DNA融入不斷發展的人類社會。. 說到食物，不要以為那些被拒絕的人只吃垃圾。相反，他們學會了在被忽視的肉類和蔬菜中尋找營養。他們學會了清潔，切塊，調味和慢燉慢燉的野菜和肉類，在食品市場上被忽略的部分家用蔬菜和肉類，並且學會了使用芳香的木煙（如山核桃，山核桃和豆科灌木 來調味g食物煮的時候1&!/ 1620844718",2021-05-12T18:38:40Z
ZyaxpS37Oqs,Home Depot is a Dow Laggard??!  It's one of my best performers this year!,2021-05-11T22:58:46Z
ZyaxpS37Oqs,Cisco is good but investing into crypto currency will be better,2021-05-11T22:17:30Z
ZyaxpS37Oqs,"Buying Cisco is nice, but also buying and investmenting in crypto currency will also be good",2021-05-11T22:15:05Z
ZyaxpS37Oqs,"Go Amazon, Apple, Facebook, Twitter, Nvidia, Microsoft, Netflix.  Disney and Wells Fargo for the recovery!!",2021-05-11T17:48:51Z
ZyaxpS37Oqs,Cisco is a legacy company whose products are absolute garbage. These clowns are bottom fishing for low PE,2021-05-11T17:30:48Z
ZyaxpS37Oqs,TOPS?! lets gooo,2021-05-11T17:28:59Z
ZyaxpS37Oqs,CXW!!!,2021-05-11T17:24:11Z
ZyaxpS37Oqs,CHOOSE CXW!!!!,2021-05-11T17:23:49Z
ZyaxpS37Oqs,Boomer pump and dump.,2021-05-11T17:18:31Z
ZyaxpS37Oqs,"If this expert trader is buying more Cisco, then I am definitely buying more Cisco . Thanks for the free tip guys.",2021-05-11T17:15:39Z
JpCUbeS6VnA,Who Cares I made $$$$$$,2021-01-15T01:51:04Z
JpCUbeS6VnA,HEY guy who is speaking in this vid....just because you say something don't mean the deal is going thru!!! Sound familiar? it should. You told that to Jim Cramer but here you are.,2021-01-14T20:36:34Z
JpCUbeS6VnA,"Buy PSEC stocks ,,,,,,,.",2021-01-14T16:00:30Z
Qs4eT3Zbjyk,"Can you make a video on QCOM, QualCOMM??",2021-08-21T13:38:56Z
Qs4eT3Zbjyk,Could you do TGT since you did WMT and HD. They reported some pretty good earnings and the stock went down as a result,2021-08-19T04:02:14Z
Qs4eT3Zbjyk,A top performer in my custom Forbes500 index fund.,2021-08-19T01:01:02Z
Qs4eT3Zbjyk,CSCO is a really boring stock,2021-08-19T00:05:03Z
Qs4eT3Zbjyk,Great vid. Can you review MA?,2021-08-18T22:17:37Z
bfJVO36UYhY,Have You Invest in Vodafone idea share.? wanna Ask Something Please comment Below.?,2021-06-24T14:09:45Z
bfJVO36UYhY,This week,2021-06-24T15:59:06Z
bfJVO36UYhY,Target sir,2021-06-24T15:58:53Z
bfJVO36UYhY,Yes sir 1 lakh share I bought,2021-06-24T15:29:43Z
bfJVO36UYhY,@Sarthak समय ok sir,2021-06-25T14:39:56Z
bfJVO36UYhY,@Veerendra Singh 1000 hi rakho,2021-06-25T13:54:35Z
bfJVO36UYhY,@Sarthak समय to kitne tk thik rahega,2021-06-25T09:08:59Z
