Video ID,Comment,Timestamp
ibAn_Fd4GWA,@Everything Money what? U guys love talking about the importance of share buybacks and dilution. Why would you remove that aspect?,2021-11-19T18:31:17Z
ibAn_Fd4GWA,There is no need for the assumption of the future price in the analyse. 👍GC,2021-11-19T18:17:49Z
ibAn_Fd4GWA,"Hi guys, just wanna say that you have changed my outlook on stocks. Before I started following your channel, I was basically buying any big name stock regardless of their prices. I managed to sell most of those that I overpaid for and made profit and used the money to buy companies that actually have a good value at this moment. I would've still made money with my previous stocks, but I would've definitely underperformed in the long run vs the SP500 index.",2021-11-19T18:12:51Z
ibAn_Fd4GWA,"Thoughts on babas organic 16% revenue growth this quarter
That’s excluding an additional 13% from an acquisition",2021-11-19T18:12:45Z
ibAn_Fd4GWA,You should do travelers looks really good,2021-11-19T18:09:17Z
ibAn_Fd4GWA,First 🤩,2021-11-19T18:00:30Z
jQTdoVpHiKw,Lol the bidder is FAT,2021-09-16T16:21:20Z
jQTdoVpHiKw,"As a new investor I have a question. Im not looking for a fish, but what else is the ""due diligence"", what more research needs to be done? What else am I supposed to look at? Im like Seth said, I thought this was the research. What else am I missing?",2021-07-28T04:12:19Z
jQTdoVpHiKw,Very informative Video. Can you please share the stock analyser tool link which you used in the video. Thanks in advance.,2021-07-12T21:48:39Z
jQTdoVpHiKw,Based on the fact that I use Cisco in my workplace all the time and I absolutely fucking hate it I could never purchase this stock even if it was a good pick,2021-07-10T04:14:52Z
jQTdoVpHiKw,"10:39 ""You have to understand for the normal viewer, this IS due diligence and there's no way they're going to do more than this."" 🤣",2021-07-09T14:35:48Z
jQTdoVpHiKw,Dilution is an illusion.  If its at free market value you have not changed NPV.,2021-07-02T19:15:04Z
jQTdoVpHiKw,"You guys rock ,thank you !",2021-06-29T02:45:45Z
jQTdoVpHiKw,"Dude! I’ve watched hundreds of hours of finance content on YouTube, and somehow never stumbled on this channel. You guys are great! Love the 8 pillars. Nice quick and dirty way to filter through stocks. I love it!",2021-06-29T01:39:38Z
jQTdoVpHiKw,Cisco licensing is so damn expensive. They have to be making a mint.,2021-06-20T22:19:27Z
jQTdoVpHiKw,the best channel,2021-06-19T22:31:10Z
jQTdoVpHiKw,"I don't understand all this Intel hype. TSM has had their sights locked on INTC for at least the last 5 years and has brought the pain to INTC in 2020. TSM makes semiconductors in the USA.  Right now TSM has 4nm and 5nm tech  when  Intel is still on 10nm. When Intel jams a large buy order to AMAT to make new factories to get with the times that is when I am a buyer. 14 nm tech from 2013-2019 is ridiculously stupid. Intel hasn't given the tech community any form of excitement for years. 

I bought some shares of INTC after they cut their CEO who is a finance guy for a semiconductor guy and did restructuring. Which is the appropriate response to losing their Apple contract to TSM. Then they have TSM working with AMD to kick Intel's ass on the PC front.  On the tablet front Qualcomm / Samsung / Mediatek / Huawei will murder them.

INTC is the Hormel of semiconductors. Yeah sometimes you just need a can of Spam instead of a steak. Spam does sell. Intel is 90% of the data center CPU market right now.  They are fighting for their last kingdom.

TSM and AMD bulls think their ticker will spank that ass. They got the street cred. They got the power. AMD gets approval for the Xilinx merger and it is GG my dudes. Because then TSM gets a backdoor entry into US national security. 

TSM has more cash on hand than intel for a price war on the server CPU front. With AMD semiconductors and their RISC semiconductors. TSM is posting up with a double barrel shotgun.

TSM did what they set out to do so far. I read every line of every statement. They wanted Apple contract - they got it. A partnership with AMD - they got it (because Intel never orders from TSM in spite of repeated efforts and offers to improve their CPUs). TSM doesn't compete with their customers and they never have. Intel was never a customer. That was Intel's biggest mistake.",2021-06-19T19:25:28Z
jQTdoVpHiKw,As a computer science major. I have to say. I LOVE THIS COMPANY and THEIR PRODUCTS. Hands down one of the best tech on the market and great prices too.,2021-06-18T16:02:18Z
jQTdoVpHiKw,"Great content, excellent videos. I'm from the UK and thinking of signing up to the Everything Money Software. How much data is there on UK companies or is it primarily focused on US companies?
Thanks",2021-06-17T19:40:14Z
jQTdoVpHiKw,Thank you gentlemen. I’m a new subscriber. Learning so much.,2021-06-17T01:22:09Z
jQTdoVpHiKw,You guys are awesome!! Love you guys,2021-06-16T21:05:23Z
jQTdoVpHiKw,Great channel !,2021-06-16T18:44:33Z
jQTdoVpHiKw,Keep bringing this horse to water and I will drink every time.. You guys are great!!,2021-06-16T09:12:40Z
jQTdoVpHiKw,Hi!,2021-06-16T05:35:12Z
jQTdoVpHiKw,This software is getting better. Can't wait for the new feature. Pretty coooool,2021-06-15T20:56:32Z
jQTdoVpHiKw,"The face of the dotcom bubble
Love the show- you guys are in the bucket of people I trust

Good luck on the
Weight loss- it’s mostly what you eat so eat those vegetables and take protein shakes to feel full!",2021-06-15T17:59:09Z
jQTdoVpHiKw,"Love the channel, great information",2021-06-15T16:41:11Z
jQTdoVpHiKw,"Hey guys, could you do Scott Miracle Gro? It has retraced from it's highs and the valuation looks better and better. Thank you guys!🍀",2021-06-15T15:45:29Z
jQTdoVpHiKw,"with the discussion on ""due diligence"" - - I think it'd be great for Seth to go and ""do some research"" come back with a video in a week or so presenting to Paul and Mo what research he's done, what his objective for this investment is, and why he would sell and take profits or hold for long run.",2021-06-15T15:01:56Z
jQTdoVpHiKw,"looking good, Seth!! Glad you took the bet, keep it up!",2021-06-15T14:52:26Z
jQTdoVpHiKw,Do you mind doing an analysis of BIGC Big Commerce? Just curious to see your take.,2021-06-15T14:39:27Z
jQTdoVpHiKw,"Hey would you do a comparison on valuation for the major global semiconductor companies? 
(AVGO, QCOM, MU, TSM, INTC, AMD, NVDA, TXN etc.) 
Much appreciated thank you! 
Keep up the amazing work.",2021-06-15T13:45:53Z
jQTdoVpHiKw,"Great video as usual, thank you. Can you please explain  the what’s and where’s of due diligence?",2021-06-15T13:18:23Z
jQTdoVpHiKw,Great analysis as usual. Can you do an analysis of CAT? Yahoo is giving a trailing P/E of 35 and and forward P/E of 18. Which P/E is more informative of value? 35 P/E seems expensive.,2021-06-15T12:50:40Z
jQTdoVpHiKw,I Wish you analyze $WISH. I'm in since 8 dollars per share but now it became into a meme stock and I'm worried. I'm a value investor not a meme seeker. Should I sell if it pops ?,2021-06-15T12:34:44Z
jQTdoVpHiKw,"Big like for this constant explanation, very good for us.... after few years will be in our DNK >(",2021-06-15T12:04:35Z
jQTdoVpHiKw,Another great vid. 👍👍,2021-06-15T11:57:50Z
jQTdoVpHiKw,Can you guys do rio tinto? Thanks!,2021-06-15T11:40:02Z
jQTdoVpHiKw,Agree with Seth. I'm gonna buy more Intel.,2021-06-15T11:11:12Z
jQTdoVpHiKw,Good vibes good analysis x,2021-06-15T10:26:36Z
jQTdoVpHiKw,How did Paul and Moe make their money? That's what I'd like to know.,2021-06-15T09:47:54Z
jQTdoVpHiKw,"One guy from shark tank says: ""take 5% of the profits every mounth or week."" Slowly selling it off, so you can still profit from future price growth",2021-06-15T09:15:33Z
jQTdoVpHiKw,Lurv the videos. Would be great to see one about when to sell a stock.,2021-06-15T08:48:27Z
jQTdoVpHiKw,That white discord in that clip is horrbile :D,2021-06-15T08:06:00Z
jQTdoVpHiKw,"In recent news: Famed investor Paul Tudor Jones supported putting money in Bitcoin (BTC-USD) on Monday, suggesting that it offers more reliability than Federal Reserve policymakers. He advocated that the ideal portfolio should contain 5% cryptocurrency.",2021-06-15T07:50:26Z
jQTdoVpHiKw,"Just started watching your videos, they are great. I’ve seen you mention the 8 pillars software, where could I get that? Thank you.",2021-06-15T07:15:23Z
jQTdoVpHiKw,"“I’m teaching you to fish, not giving you fish” 
Absolutely solid metaphor Paul, more people need to understand this! 
Solid video as per usual guys👍🏼",2021-06-15T07:00:22Z
jQTdoVpHiKw,Great video xxx,2021-06-15T06:41:11Z
jQTdoVpHiKw,"Can you explain how calculate the numbers of FCF? 13.5B in this video, thanks",2021-06-15T05:48:52Z
jQTdoVpHiKw,This channel is gradually becoming one of my favorites,2021-06-15T04:49:26Z
jQTdoVpHiKw,"Present Value of ALL future cash flows?? 
What time frame should we use in place of ETERNITY?",2021-06-15T03:23:09Z
jQTdoVpHiKw,Was waiting for this a long time..thanks,2021-06-15T03:22:26Z
jQTdoVpHiKw,"20 × Free Cash Flow? 
What is the Unit Of Measure for the 20x? 
20 Cars, camels, inches, tons? 
20 (Units Of Measure?) × FCF???",2021-06-15T03:21:09Z
jQTdoVpHiKw,"I can assure you that it is not ""stupid"" at all that the price of this stock is at fresh new all time highs not seen since its crash at the height of the dot com bubble. A time that is very historical... decades of price action on the chart that has formed a beautiful cup with handle pattern. The measured move is a 5x in price from its price of $46.47 set on September 1 year 2000. Be patient with this one.",2021-06-15T03:12:02Z
jQTdoVpHiKw,When is the analyzer going to be on patreon,2021-06-15T02:34:54Z
jQTdoVpHiKw,Can I pay for the software without joining patreon?,2021-06-15T02:32:22Z
jQTdoVpHiKw,"The trading comments claiming that AnglesRegina/whoever changed thier trading profits are most likely a cluster bot system, where many bots are commenting each other to trap unsuspecting gullible people.  Please... do not use the whatsapp number they give out.

Be careful out there",2021-06-15T02:23:18Z
jQTdoVpHiKw,"Lately I have seen these bitcoin trading comments appearing everywhere , where they hype up a person, claiming it changed their life and so on.. 

Please .. do not use the whatsapp number.. it is most likely a scam.",2021-06-15T02:13:53Z
jQTdoVpHiKw,This is a fantastic channel. Keep up the great work. Trying to binge watch your analysis… lot of watchtime lol,2021-06-15T02:13:35Z
jQTdoVpHiKw,Once you take profits Seth 😉 what are we to do with the tax burdens??? ⚖️⚖️⚖️,2021-06-15T02:07:11Z
jQTdoVpHiKw,Good job losing that weight!  Physical health goes well together with financial health,2021-06-15T02:02:17Z
jQTdoVpHiKw,"2 things I am hoping Everything Money will do :
1. Always put on description when the video is recorded.
2. Stop bitching or making sarcasm comment about Crypto, Tesla, Palantir, or other Youtubers.",2021-06-15T01:49:57Z
jQTdoVpHiKw,Why when I saw Cisco I thought of cafeterias? 😂 oops,2021-06-15T01:44:08Z
jQTdoVpHiKw,thoughts on SENS?,2021-06-15T01:08:50Z
jQTdoVpHiKw,"Wow, u really took my idea 😱
Your welcome lol, or should I say thank you🤔",2021-06-15T01:06:56Z
jQTdoVpHiKw,Cisco never hits my margin of safety after DCF evaluation. I'm interested in seeing Etsy and Nintendo ;) good job guys,2021-06-15T00:53:11Z
jQTdoVpHiKw,AMC is moving... 🚀,2021-06-15T00:40:52Z
jQTdoVpHiKw,"love the channel boys, will the software include some of your favourite stocks? ex your watchlist?",2021-06-15T00:33:20Z
jQTdoVpHiKw,Fellas y’all are the GOAT I cannot thank y’all enough! Your channel changed my life. I never thought that I would be able to get started with investing myself! I had no clue where to start but I learn everyday with your videos!!!!,2021-06-15T00:31:43Z
jQTdoVpHiKw,CSCO underperforms the market every year. Easy pass.,2021-06-15T00:29:42Z
jQTdoVpHiKw,"in my country i cant sell Puts, otherwise i would on cisco, i like the company and a few ongoing projects sound like potential increase in growth.",2021-06-15T00:12:05Z
jQTdoVpHiKw,U guys should try quick fs it’s the best in the game,2021-06-14T23:54:29Z
jQTdoVpHiKw,DO you guys think its wise to invest now in index funds at these levels?,2021-06-14T23:53:10Z
jQTdoVpHiKw,Great job guys but I am convinced that you guys cannot do a single video without bellyaching about Tesla or Palantir!!! Just let it go….,2021-06-14T23:42:44Z
jQTdoVpHiKw,Broadcom (AVGO) would be an interesting look!,2021-06-14T23:38:15Z
jQTdoVpHiKw,"Thanks Seth, you are my voice!!!!. Really, you guys are my due diligence too,  at least for now until I learn this stuff. From here, there is a lot to learn and read, it is not easy. Love Paul's analysis but I am slow and his speech is too fast for me.",2021-06-14T23:37:27Z
jQTdoVpHiKw,Respect,2021-06-14T23:29:16Z
jQTdoVpHiKw,"Hey, you can't say the stock didn't go anywhere when they pay dividends.
I understand your point, but that's still a return",2021-06-14T23:21:55Z
jQTdoVpHiKw,Do a steep covered call on it Seth,2021-06-14T23:20:30Z
jQTdoVpHiKw,"Why not just sell covered calls near the money if you're thinking about closing your position, but not sure?",2021-06-14T23:20:08Z
jQTdoVpHiKw,@Ben if that’s not your concern why would you consider closing your position? Sometime if you want to close a position you just sell…..,2021-06-15T08:35:52Z
jQTdoVpHiKw,"@sitarang07, if that's a concern of yours, why would you invest in the first place?",2021-06-15T03:35:02Z
jQTdoVpHiKw,"@MuahMan nothing wrong with that Sir. VOO and SPY is for long-term investing, you put the money there, and you come back after 15 years, it is the safest you could possibly done in stock. but if you want to start doing puts and calls, you need to diverse. They made a video on puts and calls, check it out.",2021-06-15T02:10:45Z
jQTdoVpHiKw,@Everything Money What's a covered call?  Where can I learn about Puts and Calls?  I dump everything into VOO and SPY because I don't know what I'm doing.,2021-06-15T01:24:53Z
jQTdoVpHiKw,In some cases Before you know it the stock might be down 20%….,2021-06-14T23:40:47Z
jQTdoVpHiKw,Yes thats exactly what we do. AP,2021-06-14T23:21:26Z
jQTdoVpHiKw,Love it guys. Get that stock analyzer out I can’t wait to use that. I don’t care if it’s ugly!!!!,2021-06-14T23:18:16Z
jQTdoVpHiKw,ANOTHER BANGER - KENAN GRACE VOICE,2021-06-14T23:13:51Z
jQTdoVpHiKw,I want to add CSCO and INTC. INTC is a good buy rn but I think csco can fall a little for me to be happy,2021-06-14T23:05:24Z
jQTdoVpHiKw,😮‍💨,2021-06-14T23:03:17Z
jQTdoVpHiKw,👍🏻👍🏻,2021-06-14T23:02:17Z
jQTdoVpHiKw,👍🏻👍🏻,2021-06-14T23:01:41Z
jQTdoVpHiKw,grgweg,2021-06-14T23:01:02Z
rHZWOW-eTTk,"WARNING: Since we are growing, there are increased levels of scammers impersonating our channel and that create fake accounts. The only thing we offer is our software and our patreon/discord community. The only place we send people to get access is: ​patreon.com/everythingmoney

The real links to our content are located in the description of the video. We never give out WhatsApp numbers and we are never involved in cryptocurrency related things! BE CAREFUL to not call WhatsApp or click fake links. This is happening across the YouTube platform on many channels.",2021-09-28T04:38:01Z
rHZWOW-eTTk,"I have been doing all this work myself its so nice to have like minded investors to confirm my findings, and sometimes find things I over looked. Love the videos first channel im subscribing to in years. Somehow I haven't found you guys until now, binge watching all the stocks in my portfolio. 😀 thank you!",2021-11-06T07:21:29Z
rHZWOW-eTTk,I sold mine recently and bought Amgen :),2021-10-17T18:39:40Z
rHZWOW-eTTk,"Just wanted to find out where you got the 5 year PE ratio of 27 from.  When I was checking value line the numbers have been 12, 13, 15, 16, 16 over the past 5 years?  Would love a QCOM video.  Thanks for the videos.",2021-09-29T22:59:17Z
rHZWOW-eTTk,Why is 20 the starting point in your free cah flow formula? What does the 20 represent? years?,2021-09-29T16:02:04Z
rHZWOW-eTTk,Thoughts on Ollies Bargain Outlet. Ticker OLLI,2021-09-28T22:35:24Z
rHZWOW-eTTk,where is Jimmy?,2021-09-28T20:41:28Z
rHZWOW-eTTk,"International Media Acquisition Corp
Can you please please stock analyze this stock please l. I follow you guys and watch every video.",2021-09-28T17:35:32Z
rHZWOW-eTTk,"Hey guys,

I’m in the early stages of trying to understand how to evaluate companies, been doing lots of reading and watching break downs on YouTube. I’ve really enjoyed your channel, but it’s still very new to me and I’m not picking it all up. Guessing it’ll take more time and plenty of practice before I become as fluent as I’d like. 

Because I appreciate what your doing, I wanted to offer a bit of unsolicited advice, take it or leave it, but it’s my way of saying thanks. 

Being arrogant, condescending and disparaging others (3:25 mark) isn’t a good look and doesn’t match with what I’ve seen to be true of you guys in other videos, which is the desire to educate and help others. If this was the first video I watched of you guys, I probably wouldn’t keep watching. 

Hope you take that feedback within the spirit it is intended. Keep providing quality content and I’ll keep watching.",2021-09-28T17:02:20Z
rHZWOW-eTTk,"again, the share change is wrong...",2021-09-28T15:58:27Z
rHZWOW-eTTk,"El comercio tiene que ver con la acción del precio. williams capitalistics ha sido la mejor en este aspecto del mercado. Avanzar con el enfoque correcto nunca puede estar mal.
      Sigue apilando.",2021-09-28T15:27:45Z
rHZWOW-eTTk,Maybe I would buy them if they didn’t solely sell obsolete products. This is why u cant soley look at fundamentals u must understand the business and industry.,2021-09-28T13:15:12Z
rHZWOW-eTTk,"Interesting analysis, thanks",2021-09-28T12:02:55Z
rHZWOW-eTTk,"Thx for the excellent content. I am big fan from The Netherlands and love to watch your show and analyses. 

I was wondering if you guys please could analyse ASML. The stock prise increased alot last years, but they buy back shares and are the number 1 chipmachine manufacturer",2021-09-28T09:30:52Z
rHZWOW-eTTk,do you know other stocks then aapl \ tsla \ nio \ msft \ csco and baba? these are all the stocks you talk about.,2021-09-28T09:07:15Z
rHZWOW-eTTk,Does your tool track the dividends of a stock and add it into the required return fields?,2021-09-28T03:33:04Z
rHZWOW-eTTk,I don't understand selling volume and Buying volume?  If I sell a stock to you how is that volume measured?  I sold 1 you bought 1 isn't it even?  how is volume measured as a positive or negative when we both agreed on a price??,2021-09-28T03:30:20Z
rHZWOW-eTTk,"0:55.....Cisoc hit $80.00/share give or take.....which given inflation, would be $127.00....give or take....There has been no growth in Cisco....it has just piddled along, and inflation has devalued it , as the price is static....granted, it is still a lot of money, they haven't done anything.....",2021-09-28T02:19:56Z
rHZWOW-eTTk,"Imagine how much people would subscribe if they went on a holy crusade, crushing all the meme stocks.",2021-09-28T02:14:44Z
rHZWOW-eTTk,Whats up y'all love your content keep doing what you're doing but shout out to the editor I've been watching since the software was 10 dollars but never brought it because all extra cash goes to my high interest loans and stocks rn but the videos are a lot easier to show ppl who aren't interested in stocks thank you for that editor,2021-09-28T01:40:59Z
rHZWOW-eTTk,what i love about the software is that they help you with problems and questions asap! EM future market cap will be 10.5 trillion and yes im being conservative 😉🤣,2021-09-28T01:18:07Z
rHZWOW-eTTk,Appreciate the review I have CSCO in my portfolio as well.,2021-09-27T23:53:59Z
rHZWOW-eTTk,make perfect sense paul ty gj,2021-09-27T23:31:32Z
rHZWOW-eTTk,I'm long asf on CSCO.,2021-09-27T23:16:23Z
rHZWOW-eTTk,If I sign up for the Everything Money app through Apple’s App Store will I still gain access to the desktop version and discord (The description on there only mentions the mobile app.)? Or are those features only obtainable if I sign up on the Everything Money website and YouTube  Patreon?,2021-09-27T23:08:42Z
rHZWOW-eTTk,"Guys, can you make “VALE SA” stock analysis?",2021-09-27T22:52:30Z
rHZWOW-eTTk,"You guys have saved me! I was in a bunch of HYPE, since finding your channel and software, I have dumped it all and invested in REAL companies. I sleep so so good now. My money is safer now. Can't say thank you enough. By far, the BEST channel for investing. See you guys everyday for everything money$$!!!!! Love all of you",2021-09-27T22:52:12Z
rHZWOW-eTTk,$ANET is a good company in this space. Would love to see an 8 pillar analysis on this one.,2021-09-27T22:10:09Z
rHZWOW-eTTk,Hi guys! Thanks for the videos! Would you like to take a look to Lockheed Martin????,2021-09-27T21:54:35Z
rHZWOW-eTTk,Interesting that their quoted March 19th 2000 article had a max price $141.88 per share ( PE was 196 with one of the highest ratings in S&P 500 ) and not even corrected for inflation 20 years later in today's listing dollars price !!! Also in same article 37 investment bankers recommend it as a buy or strong buy and NO holds or sell.,2021-09-27T21:32:48Z
rHZWOW-eTTk,The baseball analogy is great. I've been using similar ways of explaining why I don't and won't personally hold so many stocks at current prices. In short I am not going to pay the price for a stock that I think it should be x years from now today.,2021-09-27T21:16:37Z
rHZWOW-eTTk,"Question 
If you took Cisco at it peak in early 2000’s  and did a 8 pillar and  stock analysis  what price would you come up with ??? and would it be a buy then 
Like a backtest 
Jeff",2021-09-27T20:42:52Z
rHZWOW-eTTk,Paul was so cool and calm.this.episode...II loved it...,2021-09-27T20:37:28Z
rHZWOW-eTTk,I feel as though a great balance sheet and or Financials can justify a slightly higher PE than a similar low growth company with a bad balance sheet,2021-09-27T20:35:25Z
rHZWOW-eTTk,"Farmmi, Inc please",2021-09-27T20:10:48Z
rHZWOW-eTTk,"I love Paul he’s pure gold makes me laugh every video, and the stock analysis is good too haha",2021-09-27T19:47:15Z
rHZWOW-eTTk,-3 is a smaller number than -1. The company buying back 3% shares is a better case scenario than buying back 1% of shares. Share buybacks should have been flipped,2021-09-27T19:30:44Z
rHZWOW-eTTk,"Are you guys still doing MOrning bell, or is Mo having a bit of a break?",2021-09-27T19:24:36Z
rHZWOW-eTTk,"Waiting for BGFV sporting good please , one question how do the rising 1.4% yield in the 10yr Tbill affect CSCO?",2021-09-27T19:08:53Z
rHZWOW-eTTk,Brownstone research says Cisco is a yes,2021-09-27T18:56:46Z
rHZWOW-eTTk,good video,2021-09-27T18:47:02Z
rHZWOW-eTTk,Review Pfizer spin off company VTRS...,2021-09-27T18:44:35Z
rHZWOW-eTTk,Bought some when it was yielding over 4% based on TA,2021-09-27T18:24:33Z
rHZWOW-eTTk,Chart looks great. Above 200 day moving average,2021-09-27T18:21:13Z
rHZWOW-eTTk,"intel cisco baba , please cover some new value stocks",2021-09-27T18:20:04Z
rHZWOW-eTTk,"Good video guys, as always.",2021-09-27T18:16:38Z
rHZWOW-eTTk,cant wait till you guys do some miners like rio or vale,2021-09-27T18:13:31Z
rHZWOW-eTTk,Agree with Paul's conclusion on valuation,2021-09-27T18:09:06Z
rHZWOW-eTTk,Why multiply the 5yr FCF by 20? Where does 20 come from?,2021-09-27T18:08:25Z
rHZWOW-eTTk,shares outstanding was the wrong way round but dont think it would have improved it,2021-09-27T18:05:48Z
rHZWOW-eTTk,Paul what are you doing in a food line?,2021-09-27T18:05:27Z
rHZWOW-eTTk,"Bought this stock at $46. Now I'm going to watch this video to see if you guys hammer my investment. Lets see in 10 mins😅

EDIT: I might overpaid a bit, but I got 7/8 from the checkmarks. Maybe I will average down when the share price falls down. Still love the company and their business!",2021-09-27T18:04:36Z
rHZWOW-eTTk,CSCO has dumps like a truck,2021-09-27T17:57:34Z
rHZWOW-eTTk,TSLA TO THE MOON,2021-09-27T17:57:31Z
rHZWOW-eTTk,Hello guys can you guys check Vale and Cleveland cliffs very undervalued stock thanks🙌,2021-09-27T17:57:03Z
rHZWOW-eTTk,Seth tickling my ears is the highlights of my day,2021-09-27T17:50:53Z
rHZWOW-eTTk,Love watching you guys! Thanks for making these awesome videos. Paul I am always confused what would be the multiple I choose for valuing a company. I do understand that slow growing companies deserve much lesser multiple as compared to high growing. But I believe that there would be some math to come up with the multiple. Can you cover this topic? It would be very helpful for a lot of folks like me.,2021-09-27T17:49:27Z
rHZWOW-eTTk,"hi Guys, would you please do a reaction video of unrivaled investing? would be glad to see that, the guy (Daniel) seems to be part of your value tribe :)",2021-09-27T17:48:15Z
rHZWOW-eTTk,Paul today is talking like someone is sleeping next to him. Something is off with him today,2021-09-27T17:40:57Z
rHZWOW-eTTk,I reckon tesla chart is gonna look like this in the future,2021-09-27T17:39:25Z
rHZWOW-eTTk,"Question on the share change in the stock analyzer. It says (Higher to lower) but -3 is a lower % than -1.
Shouldn't that line be input as -1%  -2% and -3% ?
Thank you in advance for clarification",2021-09-27T17:34:35Z
rHZWOW-eTTk,"@Russianm0fia 3%, 0, -3%. 3% means issuing shares (Worst case). This is bad for shareholders since it makes your ownership decrease. -3% means they buy back the shares (Best case). Good for shareholders since their ownership increases. Left column is worst case scenario and right column is best case scenario.",2021-09-28T17:07:00Z
